video_id,url,title,duration,view_count,channel,channel_id,language_code,transcript
Gjh9Tuyu_oY,https://www.youtube.com/shorts/Gjh9Tuyu_oY,“I’m just making sure I’m the best-looking one of my friends.” 🎤: Amy Schumer #Shorts,,113000.0,Comedy Central Stand-Up,@standup,en,"as i'm getting older what i'm doing now
is i'm just making sure i'm the best
looking one of my friends it's really
easy
i cut certain people out of my life
and i now hand select strangers off of
facebook
and surround myself with real trolls and
reptiles you should see these monsters
i had a friend nikki she kept losing
weight i took her out of my phone [ __ ]
i'm sorry"
GJIywyd9mGQ,https://www.youtube.com/shorts/GJIywyd9mGQ,"“Got real drunk and then locked myself out of my hotel room, completely naked.” 🎤: Nate Bargatze",,36000.0,Comedy Central Stand-Up,@standup,en,"got a real drunk and then uh locked
myself out of my hotel room completely
naked
yeah i've done that in my two-year-old
daughter's lifetime so
if she hears this and she's like oh is
that college it's like no that's when
you were the most dependent on me"
GwCMBjZNF_s,https://www.youtube.com/shorts/GwCMBjZNF_s,“Math should be an elective. You should choose to take that s**t.” 🎤: Nore Davis #Shorts,,36000.0,Comedy Central Stand-Up,@standup,en,"if you love math i salute you but math
should be an elective
like you should choose to take that [ __ ]
because people understand that's the
only subject you're introduced to
problems
you just got there and you got problems
jim you play
art you draw signs you discover math is
like solve this [ __ ] problem
you done with that here's another
problem
you done with that these are all
problems he was like i'm six years old i
just got here why do i have all these
problems"
ZMnunbWZG7g,https://www.youtube.com/shorts/ZMnunbWZG7g,"“When you don’t drink, people always need to know why...” 🎤: Jim Gaffigan #Shorts",,138000.0,Comedy Central Stand-Up,@standup,en,"when you don't drink people always need
to know why too they're like you don't
drink why
this never happens with anything else
you don't use mayonnaise why
are you addicted to mayonnaise
is it okay if i use mayonnaise"
v-f66SzHL2M,https://www.youtube.com/shorts/v-f66SzHL2M,"""My favorite day is the day after Halloween..."" 🎤: Cristela Alonzo",,59000.0,Comedy Central Stand-Up,@standup,en,"i hate halloween you know my favorite
day is the day after halloween because
that's when you see all the sexy girls
in the costumes doing the walk of shame
back home i love it
because a sexy kitten isn't sexy anymore
you know she's got a broken ear
the sexy button the bunny is missing a
tail they look like the abused pet
commercials from the sarah mclaughlin
you know
this sexy cat lost its tail banging a
pirate
[Applause]"
ibr9NrL8k8M,https://www.youtube.com/shorts/ibr9NrL8k8M,“They always make Black people fall in slow motion.” 🎤: Roy Wood Jr.,,56000.0,Comedy Central Stand-Up,@standup,en,"civil rights movies get me all the time
man they give me what they're humming
and then they always make black people
fall in slow motion
yo every civil rights movement black
person follows why you got to slow down
my pain just play it at regular speed
anytime a black person follows in the
civil rights movie they fall and they do
that double bounce and the dirt and the
dirt come up
get out of here scout up
[Applause]"
1wnUJxGDMY8,https://www.youtube.com/shorts/1wnUJxGDMY8,You can’t just ask a Black person if they know every other Black person. 🎤: Sasheer Zamata #Shorts,,46000.0,Comedy Central Stand-Up,@standup,en,"i went camping for the first time
recently
thank you
i'll never do it again
i feel like when i tell people i've been
camping for the first time they're like
but you're a full adult
but i'm
black
it's not something my family did
my parents were like we bought a house
we sleep on the inside"
VLt5eT5XoNc,https://www.youtube.com/shorts/VLt5eT5XoNc,"“Mexicans, we speak Spanish slow...” 🎤: Gabriel Iglesias #Shorts | Subscribe  ⬇️",,1700000.0,Comedy Central Stand-Up,@standup,en,"puerto ricans you guys are like mexicans
that you know have a time limit when it
comes to spanish
you speak it quick mexicans we speak
spanish slow you know hey how's it going
[Music]
puerto ricans man hey what's up
lina"
YcD3X5ERoTg,https://www.youtube.com/shorts/YcD3X5ERoTg,“You guys remember when the lights would go out in your school?” 🎤: Donald Glover #Shorts,,106000.0,Comedy Central Stand-Up,@standup,en,"you guys remember when the lights would
go out
in your in your school remember that
like in the third grade like when the
lights would go out like
[Applause]
like
[Applause]
kids just lose it it wasn't even dark
it's like 2 p.m
sunlight is coming through the window
kids are just like
like just like losing their minds
and the same junk what happened when
there was a fire drill and the principal
would come on and tell you there was
going to be a fire drill
like in two minutes it's gonna be a fire
drill
[Applause]"
2o9jkV-DJ9I,https://www.youtube.com/shorts/2o9jkV-DJ9I,“Men are hunters. Women are gathers.” 🎤: Iliza Shleslinger #Shorts,,239000.0,Comedy Central Stand-Up,@standup,en,TranscriptsDisabled
-b0pIQtO8Mw,https://www.youtube.com/shorts/-b0pIQtO8Mw,The Time Pete Davidson's Mom Bought Him Condoms - #Shorts,,60000.0,Comedy Central Stand-Up,@standup,en,"it's fine if you're a mom and you want
to buy your son condoms it's just a way
to do it
you know if you want to get your son
condoms
just get him and leave him in his room
don't tell him he'll find him
that's the way that's not what my mom
did my mom did something really weird
right it was really weird i was still
staying at her house at the time and it
was like 11 30 at night
and she just barged in she didn't text
knocked just barged in and she was just
like hey
i got something for you
and i was high so i was like what the
[ __ ]
this is a little weird
and i swear to god i turn on the lights
this is what she does she has it
she had it behind her back and she pulls
out a 40 pack and i swear to god the
switch does she goes i got every kind
for my baby boy"
jB1YGx9myE0,https://www.youtube.com/shorts/jB1YGx9myE0,The Loophole - Garfunkel and Oates #shorts,,69000.0,Comedy Central Stand-Up,@standup,en,"never learned about the birds and bees i
was taught to keep an aspirin in between
my knees cause the bible says premarital
sex is wrong
but jason says that guys can't wait that
long and i don't want to lose him to
someone who'll do him i need to figure
something out
well there's a loophole in the scripture
that works really well so i can get him
off without going to hell
it's my hail mary full of grace in jesus
name we go to fifth base
oh thank you for making me holy and
thank you for giving me holes to choose
from and since i'm not a godless [ __ ]
he'll have to come in the back door
therefore [ __ ] me in the ass cause i
love jesus
the good lord would want it that way
give me that sweet sensation of a
throbbing rationalization
it's just between you and me cause
everyone knows it's the sex
that god can't see"
bRhVcK28dv0,https://www.youtube.com/watch?v=bRhVcK28dv0,Only Dog Owners Will Understand... | Kevin Bridges: A Whole Different Story,37.0,62158.0,Comedy Central UK,@comedycentraluk,en,"I'm in the park my dog's here another
dog came over began to play with my dog
began sniffing my dog sniffing away
having a great time I'm parting the
other dog and I said and who's this
that's dog walk or talk for what is your
dog's name that's how you strike up a
bit of chat
I said who's this and the guy goes uh
Lucy or this is uh this is Diego
and I thought oh naming the dog after
the eagle Maradona I will explain the
sniffing then right"
Ji9xaNn-1A4,https://www.youtube.com/watch?v=Ji9xaNn-1A4,'Beyoncé Calls It Jelly!' 😂 | Amy Schumer: Comedy Central Presents,30.0,116894.0,Comedy Central UK,@comedycentraluk,en,"I do okay in New York you know for a
comedian I'm bringing the Thunder up
here okay comic come on yeah
I usually do okay in New York I'm like a
six like seven with all the padding but
in Miami I was like a negative three
people were like what the is that
throwing up on their motorized
wheelchairs
children were crying I was like Beyonce
calls it jelly they were like that's
cottage cheese"
n3D7ZN4q1Q8,https://www.youtube.com/watch?v=n3D7ZN4q1Q8,Pour that anger into my ears...🎤 #ComedyCentral Presents #StandUp #Comedy #VanessaHollingshead,50.0,2137.0,Comedy Central UK,@comedycentraluk,en,"it's like I've spent my whole life
saying no problem you know it's like oh
you don't have the steak that's fine
I'll have the chicken no problem
whatever's easy for you yeah the shf
whatever no whatever is easy yeah um no
you you don't want to promote me even
though I've worked harder than any
person in this company no problem you
know maybe next year yeah fine yeah oh
you don't want to see you want to start
seeing other women keep this casual no
problem yeah no spread the love around
I'm cool with that yeah whatever you
want you don't want me to call you
you'll call me no problem yeah well you
know what now I got the problem all
right so I feel like I can't get mad so
you know what I do I listen a DMX I love
he gets angry for me that guy is angry
you know and plus I understand his
lyrics you know so he's like the people
the prisons the power the systems I'm
like my life my hair I hate it when is
he going to call
[Applause]"
xECKwiVxPhg,https://www.youtube.com/watch?v=xECKwiVxPhg,'Siddon Pon Me Cocky' | Kyrah Gray: Comedy Central Live,52.0,164109.0,Comedy Central UK,@comedycentraluk,en,"had a Jamaican man DM me the other day
and he said and I quote
I want you to sit on upon me cocky
so I can look into your hazel eyes
and see heaven
I know I was in shock man I didn't know
how I was supposed to respond but I just
remember reading this and being like
this
is romance
you know this is the most beautiful
thing
any man has ever said to me
I know a marriage proposal when I see
one
the answer's yes"
UOr6kggJf_s,https://www.youtube.com/watch?v=UOr6kggJf_s,Don't knock it 'til you've tried it 🚀🌖,60.0,474255.0,Comedy Central UK,@comedycentraluk,en,"They were in the space race with Russia.
So they were trying to beat Russia to
the moon. But also the Cold War they
were showing off. Yeah. We've never been
back. If they have been back, they've
been there. They didn't just go once.
They went seven times, but they haven't
been for 25 years, I think, since 1974.
What's the point? There's nothing there.
I went to Basel once.
Once I'm going back there.
Kim, you're a proud American, right?
Yes. Now, the moon mission. They're
saying it didn't happen. It did. It did
happen, right? I would like to believe
that it did. Well, even that seems a bit
non-committal,
but let's take it let's take it as red
that they landed on the moon. That is an
incredible achievement, isn't it? Yeah.
Matthew, your thought? Yeah. Well, also,
you can um you can now go up to space,
can't you? There's there's uh sort of if
if members of the public are allowed to.
Yeah. Richard Branson's Virgin Galactic.
You can go up to sort of zero gravity.
Yeah. He says um anyone can go up. Costs
200 grand. So, literally anyone can go
up."
cDf3WfATlto,https://www.youtube.com/watch?v=cDf3WfATlto,Jamaican horror movies are the worst horror movies... 👻 #ComedyCentralLive #StandUp #KyrahGray,20.0,73036.0,Comedy Central UK,@comedycentraluk,en,"this is how a Jamaican horror film would
go you would see a Jamaican family move
into a
house you'd see them all go to
bed you'd hear a
demon in the middle of the night say go
home everyone would sit up and say all
right and leave"
sL6UtF8KbpY,https://www.youtube.com/watch?v=sL6UtF8KbpY,Would Dumbledore have been a Corbynite? 🧐,60.0,8489.0,Comedy Central UK,@comedycentraluk,en,"a friend of mine said that he'd lost a
lot of respect for JK Rowling then we
had an argument because I have a lot of
respect for JK Rowling you know I have a
lot of respect for JK Rowling I respect
the tenacity and drive that woman has in
destroying her Legacy you know like it's
amazing to watch it's thrilling like the
focus of a fighter Pilot's
amazing she wrote Harry Potter right
that's the biggest book series ever
she's a billionaire she lives in a car
she has nothing in this life to prove to
anyone and now she just spends her days
on Twitter just causing Havoc just doing
it for the Love of the Game you know
ruining childhoods destroying dreams
it's
amazing sh this weird period where she'
try and sort of win Niche political
arguments online but using her own
characters she say things like well
dumble door would have never voted for
[Music]
Corbin you can't do that"
lKgyOdvhPzg,https://www.youtube.com/watch?v=lKgyOdvhPzg,"Ngl, being an alien and spitting acid at commuters sounds great... 👽",60.0,44420.0,Comedy Central UK,@comedycentraluk,en,"the movie Aliens isn't that the best
those
aliens you don't mess with those
aliens they're bad ass looking they're
always wet
[Applause]
and you don't mess with that
if I got on the subway like
[Applause]
that you wouldn't mess with
me they have that spit they have that
acidy spit I want
that why not
[Music]
me I would love to have acidy spit"
0SSsoBdj3RI,https://www.youtube.com/watch?v=0SSsoBdj3RI,British people don't deserve the ☀️,58.0,17419.0,Comedy Central UK,@comedycentraluk,en,"British people we sunbathe like we've
been shot we're just
noral bar what time is it back home do
you think we conf Fone now oh that's hot
on me boom that is did you put 20 on it
or 15 they're just dying inside you can
see all the burnt bits from previous
bikinis patches of Ginger hair that
don't equate to the rest of the body and
not being rude but even the children I
mean foreign children they just look
amazing they don't have an ounce of body
fat perfect hands they swim like
dolphins you don't even see a splash
when they enter the water they just
emerge at the other
sidea
[Music]
magnifical British kid we've got cream
La into our body all over our faces in
our eyes"
_OpuktxZn1g,https://www.youtube.com/watch?v=_OpuktxZn1g,"""My Sister's Vagina Was That Big!"" | Kelly Convey: Comedy Central Live",53.0,12973.0,Comedy Central UK,@comedycentraluk,en,"second one Alfie he came along different
story he was a nightmare he got stuck
his shoulder was stuck we were there for
hours I was exhausted right now finally
the nurse came in and she said Okay
ladies we've got him in a position where
we were able to get him out now Claire
what I want is my sister she's that
Claire I want you to do is when I say
push I want to push down into your
bottom now Kelly if you just want to
come down to the end of the bed what I
want you to do is take your sister's
feet and when I say push I want you to
push up into your sister's feet and
we're gonna get this baby out I'll say
okay babe look come on you know I want
to go home right so I got down to the
end of the bed I took one foot in one
hand I took a foot in the other and then
I looked up
and I had to tell you ladies and
gentlemen that my sister's vagina was
that"
Fa1AxcWa970,https://www.youtube.com/watch?v=Fa1AxcWa970,"But...He Did Apologise, Right? 🤔 | Donald Glover: Comedy Central Presents",60.0,170802.0,Comedy Central UK,@comedycentraluk,en,"you're with your girl you're sleeping
and all of a sudden
ow and she'd be like I just had a dream
when you were sleeping with another
woman
[Applause]
and you'd be like
[Applause]
so
she'd be like explain yourself
now anybody else in the world any other
human being you'd be like oh that person
has mild schizophrenia right
but because she's your girl and you love
her you'll be like oh well you know me
and you and no
no dudes if your friend came up to you
you
let's be like hey man I had a dream
where you were mean to me
stepped on my foot you ain't saying
nothing"
BEMWzPUVe24,https://www.youtube.com/watch?v=BEMWzPUVe24,Rosie Jones: “Is She Pretending To Be Disabled?” | Comedy Central Live,16.0,77785.0,Comedy Central UK,@comedycentraluk,en,UnexpectedLanguage
g0GKD1LaOKg,https://www.youtube.com/watch?v=g0GKD1LaOKg,"A ""rye"" sense of humour... 🥪 #ComedyCentralLive #StandUp #PierreNovellie",15.0,5669.0,Comedy Central UK,@comedycentraluk,en,"Amazon Fresh
no it's rye bread it was not and never
shall be
fresh I buy my bread from the same part
of the website that sells me hammers"
KbaZTUf0gJ8,https://www.youtube.com/watch?v=KbaZTUf0gJ8,Want To End A Relationship? Go On Holiday | Axel Blake: Comedy Central Live,60.0,60693.0,Comedy Central UK,@comedycentraluk,en,"holidays will test your friendship even
relationship yes yeah exactly yeah yeah
turn to a documentary Now isn't it
forget a comedy it will test your I know
people that's been friends for 10 years
take a holiday together for seven days
come back and you ask them how was the
holiday how's you and Kelly Kelly I
don't check it out no more
18 men
Kelly's my sister by the way yeah and
now you're smiling in it
and a women love a couple's holiday
tell their friends I'm going to holiday
with my man all the friends
[Music]
it's not the same though with guys
when you tell your friends you're like
I'm going to holiday with my girl
with the friends of that my condolences"
TbV7xSjHcyo,https://www.youtube.com/watch?v=TbV7xSjHcyo,Got an A* in being funny… 😂 #JackSkipper #ComedyCentralLive #StandUp,15.0,5520.0,Comedy Central UK,@comedycentraluk,en,"the gizer gave me a job because he saw
sank in me he did he looked at me and
went you've got it now you've got it and
all my FIT is here they've all got it
and you know what they've got no
qualifications"
PlJ14XiG8RI,https://www.youtube.com/watch?v=PlJ14XiG8RI,Very funny! 👁👄👁 Actually no I didn't like it. 👁👄👁,60.0,9223.0,Comedy Central UK,@comedycentraluk,en,"how much is too much
Botox now before I continue I want you
guys to know if anybody in this room has
had cosmetic surgery like botox or is
considering cosmetic surgery that is
entirely your prerogative long as you're
happy my job is to observe never to
judge I was just trying to work out how
much is too
much I think I may have worked it
out if I make a joke about
Botox and you don't like it but I can't
[Applause]
tell that's too much Botox I think cuz
after my set a lady came up to me she
was like I didn't care for your comments
about Botox mate and I was like well
your face tells a different
story"
H3D0A9-0Azw,https://www.youtube.com/watch?v=H3D0A9-0Azw,For God's sake... 😫 #ComedyCentral Presents #StandUp #Comedy #EddieGossling,55.0,6006.0,Comedy Central UK,@comedycentraluk,en,"when you do marry into the Catholic
Church you have to have meetings with
the priest and uh so we would' have
these meetings and at the end of every
meeting I was like he the priest would
be like God bless you and I was like God
bless
you and he's like uh God bless you and I
was like back at
you and then my wife was like what the
hell are you
doing I was like what I'm blessing the
priest she's like you can't bless a
priest I was like sure this guy blesses
people all the time I bet you he'd like
to hear a blessing
she's like no she's like this guy made
all kinds of sacrifices this is the one
thing in life that he can do is to bless
other people you cannot do that and I
was like nah I think he likes to hear
it but then I thought about it and I
don't like it when you people tell me
jokes after the show
[Applause]"
m7mWC9eQ3rU,https://www.youtube.com/watch?v=m7mWC9eQ3rU,Everyone loves a lonesome cowboy... 🤠 #TheMeltdown #StandUp #Comedy #AndyDaly,59.0,1752.0,Comedy Central UK,@comedycentraluk,en,"[Applause]
I think I'll read you one more because
your time is not valuable to me this
uh this one is called that lonesome
Cowboy I believe it is my most beloved
poem a Cowboy is a lonesome man there's
none more Lonesome in all the land he
rides a top his only friend his horse a
companion on whom he can depend his
woman may be miles behind him sadness
and Desperation may find him but a
cowboy who's wise will turn to the Earth
to lend him Solace and even Mirth
he'll dig a hole with cracked scorched
hands pour in all the water that hole
demands until that hole is moist just
right the Earth will never put up any
kind of a
fight his cries of Joy no one will hear
in case I am not being clear I'm saying
that cowboy is going to a hole in the
ground
[Applause]
[Music]"
wEglPuAv8jM,https://www.youtube.com/watch?v=wEglPuAv8jM,Richard Pryor was the worst thief 👮‍♂️,60.0,233036.0,Comedy Central UK,@comedycentraluk,en,"[Applause]
I used to be a thief and I wasn't very
good I always got caught and I would
steal from Neighbors I wouldn't take no
chances on getting caught too far from
home I'd go over to the neighbor's house
wipe them mother out I paid them all
back now I try to go back to here I'm
ashamed of myself go Miss Johnson I'm
sorry I bust in your
house I knew it was you
boy I don't know why I would steal I my
grandfather was in business my family
was in business my my my grandmother and
them own like three or four brothel and
my grandfather had a pooh haul right
called pops pool room my uncle had a
pool room so it was money in the family
I was a lucky black child right cuz I
never went through no hard times
about it was hard if you wasn't poor you
couldn't get no
buy we just to keep our minds off
eating"
hpVARkTlGp8,https://www.youtube.com/watch?v=hpVARkTlGp8,There’s No Black People In Africa | Comedy Central Live,55.0,7934.0,Comedy Central UK,@comedycentraluk,en,"people say that when you travel you find
out something about yourself I came to
the UK I discovered I was black
[Laughter]
see I didn't know because like I'm from
Africa and in Africa we don't actually
know we are black you know we are all
walking around Africa thinking that we
are just people
are black but we are not though some of
us are like browners are medium brown or
there's a dark brown I guess it's easier
for white people because you only have
two shades before and after sun
so weird so weird so I uh I grew up just
100 kilometers south of the Equator
and I said this at another gig and the
guy the front goes what is a equator
for real and before I could say anything
the guy on the other side it is the
imaginary line that divides the World by
half I was like no that's racism"
DYX6pfLYbQk,https://www.youtube.com/watch?v=DYX6pfLYbQk,"Not old, just need recharging... 🪫",56.0,4428.0,Comedy Central UK,@comedycentraluk,en,"I looked at her painting ah for
sake and it was just such a relief and
this woman turned to me and she went you
do know we could hear that and I was
like oh sorry I come on and she went
well I you're right that one's bloody
and she stored off and that's I genu I
found it a tremendous relief that
suddenly all of these things can be
released again because when I was
younger I was so worried about judgment
and now I've got to an age where I
constantly talk to myself and like I
said the proximity I don't like being
that much older uh there are downsides I
mean it's like 43 is not that old it's
not that old but if if my life was
measured out like a battery indicator on
a computer I wouldn't be overly worried
but I would be wondering where the
nearest plug was it's that kind of thing
i' I've reached that stage and it's uh
and I noticed little things as well like
the bit of my brain that stops me from
going to the news agents in my pajamas
has got weaker and weaker"
jr4aYQwE3N4,https://www.youtube.com/watch?v=jr4aYQwE3N4,"""Why You Running, Baby?"" 😂 | Kevin Hart: Let Me Explain",49.0,63738.0,Comedy Central UK,@comedycentraluk,en,"I respect people are working
nine-to-five job I can show them late
for work without an excuse they show up
take full responsibility hey I'm sorry
I'm late it'll never happen again I
overslept I apologize it's irresponsible
on my behalf if I do it again fire me I
respect people that can do that because
I can't do that because I'm a flyer I am
if I'm late something happened something
drastic happening
yo dude sorry I'm late I was on the
highway and a baby was running
on the highway
yeah I know right it's crazy so I get
out the car I start chasing the baby in
my mind I'm like why you running baby
that that's what I'm thinking right I'm
like what do you do because I can't just
grab the baby and throw the baby in the
car that's kidnapping around go to jail"
4uFm8dN-PiY,https://www.youtube.com/watch?v=4uFm8dN-PiY,How to know when your wife is angry 🤬 | Standup,49.0,13204.0,Comedy Central UK,@comedycentraluk,en,"oh BL have got loads of them there's the
bus
driver there's the helicopter pilot you
know you ever had that argument with
your wife you're winning and she starts
to cry that's it
you're crying is the most potent way of
winning an argument you go yeah you she
go oh sorry l
my
fault you always know when a woman's
really angry cuz if you notice their
words get further and further apart if
you notice that
don't
you
care she's angry"
