video_id,url,title,duration,view_count,channel,channel_id,language_code,transcript
JYjRBzuVFwQ,https://www.youtube.com/shorts/JYjRBzuVFwQ,"""If you had Puerto Rican girls reffing the games..."" 🎤: Chris Distefano #shorts",,192000.0,Comedy Central Stand-Up,@standup,en,"it was great being in a relationship
with her but I didn't know like Latino
women like I didn't know that like
you're under investigation like it's
just when you date a Puerto Rican girl
you need to have the answers quick you
need to like have facts right away
because they will interrogate you and if
you don't have the answers quick you
look like a liar and they watch men they
are designed to watch men watching
waiting that's what they do they make
excellent NFL referees I think if you
had Puerto Rican girls reing the games
you'd have zero Miss calls the whole
season because they see everything so
that's just what could you imagine they
were the refs they would be right there
like um you out of bound stupid no
no I mean for real you out of
bounds I don't need instant replay I I
instantly saw you step out of bound so
you
know I mean I don't even know the rules
just go home
bye you out the game"
Aay2CmDwAoU,https://www.youtube.com/shorts/Aay2CmDwAoU,"""I like professional football."" 🎤: Demetri Martin #shorts",,131000.0,Comedy Central Stand-Up,@standup,en,"I like sports I like professional
football I like to go yeah
wow I like to get to the stadium I like
to get to the stadium to see the games
live you know and I paint my chest
before I leave the
house but I don't have that many friends
you know so I usually just do
punctuation like tack on a group already
in
progress but sometimes
like but sometimes it works out kind of
weird cuz we we ended up on TV one time
and it said uh
Jets"
q9NxddF0Q8Q,https://www.youtube.com/shorts/q9NxddF0Q8Q,"""There's 16,000 white people."" 🎤: Finesse Mitchell #shorts",,85000.0,Comedy Central Stand-Up,@standup,en,"you know I mean Minneapolis Minnesota
let me set this up I'm going into the
Target Center right I'm all excited but
I'm getting a little nervous cuz I'm on
the 10th row and as I look around it's
16,000 white people and I'm like all
right I I can do this this is cool all
right but then I look up in the upper
balcony and I see a couple of black
people all sprinkled out and I'm like
why are y'all up there and they looking
at me like how the hell you get down
there and I'm like forget all that can
you get to me in case something go on
down here I'm only one down here I see
you brother do you see me can you get to
me all right all right all right how you
doing how you doing all
right"
MC1gMSY1tFM,https://www.youtube.com/shorts/MC1gMSY1tFM,“You guys ever rob a house?” 🎤: Ethan Simmons-Patterson #shorts,,52000.0,Comedy Central Stand-Up,@standup,en,"you guys ever rob a house no just me all
right cool I used to think that was a
normal thing people did I thought you
did that in high school I thought
everybody did in high school thought you
went to prom hit puberty robbed a couple
houses you know then I went to college
and I was like you guys ever rob a house
and they were like what and I was like
let's just play beer pong man why we
asking why we talking about high school
what the [ __ ] is going on we weren't
good at robbing houses though we would
Rob like nice white people's houses so
we would just end up learning stuff
about houses that we didn't know you
know like we break into the house and we
like oh
WAOW forget to rob it we would just
leave and be like wow that was a nice
open concept kitchen you know
like that was pretty dope never seen a
backsplash
before yeah I learned a lot about houses
man I didn't know you could have a
finished basement I didn't know that was
a thing I thought all basements came
unfinished and that's where you kept
meats and dogs I didn't know white
people were keeping their horny teenage
Sons down there that's crazy dude just
throwing Hot Pockets at Trevor down the
stairs see"
EBX7LKQapGI,https://www.youtube.com/shorts/EBX7LKQapGI,"""Well, somebody married her ."" 🎤: Erin Jackson #shorts",,62000.0,Comedy Central Stand-Up,@standup,en,"I'm a single lady and I'm not always
happy about it when I get really bummed
out about it one of my favorite things
to do is go couple watching I love it
like I just like to observe couples in
their natural habitat like I'll go to
like a park if the weather's nice or
I'll go to the mall and I'll just watch
the couples walk by okay and then I'll
play a game called well somebody married
her and it
always always makes me feel
better I'm like don't give up e she
found a husband you know yeah"
O4NgR78vNws,https://www.youtube.com/shorts/O4NgR78vNws,“I quit on some boss b*tch sh*t” 🎤:Brandi Denise #shorts,,47000.0,Comedy Central Stand-Up,@standup,en,"I lived in Chicago and I was a social
worker yeah I quit 6 years
ago followed my dreams I'mma tell you I
quit the realest way too I I quit on
some on some bossfit [ __ ] um if you
watching this and you work at DHS what's
up
um but no like I knew I was going to
quit but a week before I quit I I did
like some just real arrogant [ __ ] I got
I do what I want tattooed on the back of
my
neck
it just wore my hair in a ponytail to
work for the rest of the [ __ ] week
they be like Brandy can you fax these
papers I was like
no"
tK3LROtWBMs,https://www.youtube.com/shorts/tK3LROtWBMs,"""I'm trying to help 'em out."" 🎤: Tess #shorts",,76000.0,Comedy Central Stand-Up,@standup,en,"women a lot of women don't talk about
these type of things I'm trying to help
them out like birth control they don't
you can't try everything out there see
cuz when they put it out there they
don't never come back and tell us when
the lab monkey die they just leave
it like that uh what was that that one
you put in your arm you don't have to
worry about getting pregnant for three
years oh you don't have to worry about
no birth control no pregnancy for three
years yeah they right um but I also
didn't have any
eyebrows you
know I had a mysterious lump under one
arm couldn't grow no pubes you
know that's why I didn't get pregnant
for three years I look like a damn freak
that's
why"
AIf6I40S9nw,https://www.youtube.com/shorts/AIf6I40S9nw,"“You know that interview was a son of a b*tch” 🎤: Roy Wood, Jr. #shorts",,2500000.0,Comedy Central Stand-Up,@standup,en,"you got to respect a white person work
at a black history
museum you got to respect that that was
a
choice he white he could work anywhere
he
chose a black history museum you know
that job interview was a son of a
 how many extra questions did he
have to answer cuz you black and old it
ain't to work at the Civil Rights
Museum you just walk in uh that's me on
the
picture
you filling out paperwork for a you on
the
wall but if you white you know they
grilling that dude asking them all kinds
of questions they had nothing to do with
black history all in that dude
face people work looks good everything
checks out real quick uh at what
temperature do you deep fry
[Applause]
catfish"
TWvb-eUr2s4,https://www.youtube.com/shorts/TWvb-eUr2s4,"""You're a bad man."" @jeffdunham I’m With Cupid February 3rd 8/7c Comedy Central. #shorts",,70000.0,Comedy Central Stand-Up,@standup,en,"so cupid aren't greeting cards a good
way of expressing your love for someone
oh sure yeah greeting cards are good for
anybody in fact I've written a feel
myself some greeting cards can you
recite a couple for us sure do you have
one for longtime married couples oh
absolutely here we go our love all these
years has been a blissful occurrence I
wish you would die so I could collect
the
insurance now
okay how about one for younger couples
younger couples great okay leading you
was amazing luck and I think of that
most each time that we whoa whoa whoa
whoa whoa
whoa have dinner what' you think I was
going to
say you're a bad
man"
gU6_5nU4Sl0,https://www.youtube.com/shorts/gU6_5nU4Sl0,"""You guys ready for the little people in the boxes?"" 🎤:@jeffdunham #shorts",,27000.0,Comedy Central Stand-Up,@standup,en,"here's Jeff
G you guys ready for the little people
in the
boxes hello Cupid I'm Walter damn it how
your first date go lean it up in the
backseat of the car your car no squad
car now it's asking your relationship
intent is there a check box floor land
Dan thinking L Jeff D I'm with Cupid
what's the difference between love and
lost 50 bucks the all new special
Premiere Saturday February 3r8 on Comedy
Central"
UNpOzvZPgJ4,https://www.youtube.com/shorts/UNpOzvZPgJ4,"""When you get a little rando text..."" 🎤: Nick Swardson #shorts",,591000.0,Comedy Central Stand-Up,@standup,en,"it's always a fun feeling right when you
get a little Rando
text your phone buzzes you're
like uh okay not programmed right just a
number so I get a text from like that it
was like hey what's up I'm like
H uh nothing what's up with you it's
fake into whoever it is so they replied
not much what's your plan tonight so I'm
like they have my phone number they must
know who I am so I go
I'm actually drinking a bottle of vodka
right now debating shoving it up my
 what uh what's your
plan there was a pause and they replied
oh I'm just hanging out with Uncle
Pat
yep it was my 11-year-old
niece"
1KbHL_sWnNY,https://www.youtube.com/shorts/1KbHL_sWnNY,"""Peanut butter and jelly in the same jar..."" 🎤: Brian Regan #shorts",,89000.0,Comedy Central Stand-Up,@standup,en,"I was in the store I saw that uh peanut
butter and jelly in the same jar
stuff what in the hell is
that is there a point that that I mean
I'm lazy but uh you
know I want to meet the guy that needs
that you know some guy going you know I
could go for a sandwich but uh I'm not
going to open two
jars I can't be opening and closing all
kinds of
jars cleaning who knows how many
knives if you're that lazy why not put
croutons in there get the whole sandwich
on one
spoon scous I will have a
second delectable as was the
first if you don't want to clean a spoon
you put on a squeeze
bottle"
TX2JLSU3FJI,https://www.youtube.com/shorts/TX2JLSU3FJI,"""The worst is being the sober cab."" 🎤: Nick Swardson #shorts",,81000.0,Comedy Central Stand-Up,@standup,en,"worst is being the sober cab and
everyone in your car is shitfaced and
you have to go through a fast food
drive-thru and try to get everybody
food and you're the only one in control
see your driver SE you're at the
microphone everyone's just a disaster
you're like Mark what do you
want
cat what was
that
[Music]
yeah yeah I don't speak Japanese have no
idea we just said just pick a meal
number what meal number do you want 48
no they don't go that high what meal
number goes to
48 Steve what do you want do they have a
wedding
cake"
q3FGuM35dkY,https://www.youtube.com/shorts/q3FGuM35dkY,"""Everyone got fat during the pandemic.""🎤: Jenny Zigrino #shorts",,34000.0,Comedy Central Stand-Up,@standup,en,"everyone got fat during the pandemic I'm
happy about it I'm a fat person where
other fat people at cool all right I
have eyes some you should be clapping I
don't know what just embrace it okay
it's true I'm happy cuz during the
pandemic all I got were weird way loss
emails they were just like how many
push-ups can you do during quarantine
all right don't get fat your dad's dead
whoops like that was every email but
it's just like I don't care you think I
care what's going to happen when like
the world's over you think I give a
what my butt looks like when I'm wiping
it with leaves I don't care do you think
they did that during the plague where
they're just like oh no Joffrey lost his
entire family but did you see how many
burpees he can
do he has a sixpack one for every family
member he's lost"
JCaM_dR0vh0,https://www.youtube.com/shorts/JCaM_dR0vh0,“SENIORS ‘08” 🎤: Bo Burnham #shorts,,103000.0,Comedy Central Stand-Up,@standup,en,"but I actually just graduated high
school senior 08 and
um so this song this next song is is is
from first
[Music]
person high school party senior year
boys and girls they're all sipping on
beer I like soda where's the soda am I
the only person here that likes
[Music]
soda all right
I see you from across the crowd I said
the party is bumping and the music is
loud you're really drunk and you're
looking sad it's like a Craigslist ad
girl then we start to dance and girl
baby this is romance girl I'm starting
to grow down below why did I wear
sweatpants"
i_8D-o8YePQ,https://www.youtube.com/shorts/i_8D-o8YePQ,"""If you're not familiar with taking an edible..."" 🎤: Ayo Edebiri #shorts",,95000.0,Comedy Central Stand-Up,@standup,en,"and if you're not familiar with taking
an edible it's pretty simple uh you
ingest the edible and then you wait you
know anywhere from like an hour and a
half to um the rest of your life for
your most toxic memories to just like
drop kick you in the back of your throat
this time you on like a sweet little
roller coaster ride of like your most
present anxieties and all the worst
things you've ever done to the people
who loved you the most you know"
TReQuSWQUfc,https://www.youtube.com/shorts/TReQuSWQUfc,"""I used to pretend to like sports."" 🎤: Esther Povitzky #shorts",,2200000.0,Comedy Central Stand-Up,@standup,en,"when you look like me you tend to date
guys who have really strong feelings
about
magic and if I can pretend to like magic
for one night aren't I the greatest
magician of
all magic has always been the perfect
subject for me to pretend I either like
it or dislike it like I used to pretend
to like sports guys girls don't like
sports okay and if you meet a girl and
she likes Sports it's just cuz her dad
really wanted a
son I've seen girls talk to guys and
they're like hey did you see LeBron
scored a double
triple and I just want to walk up to
them and be like you're
beautiful you don't have to do
this come with me let's let's go to
Sephora"
7xOv9kUzj1c,https://www.youtube.com/shorts/7xOv9kUzj1c,"""I don't know if you've ever lost a kid in the Pacific Ocean..."" 🎤: Craig Conant #shorts",,185000.0,Comedy Central Stand-Up,@standup,en,"I was babysitting my little nephew again
I'm 10 years off narcotics and alcohol
I'll be back don't applaud
that so she trusts me again I take my
little nephew down to the ocean I put
him on a boogie board just very shallow
in the white water and I don't know if
God is mad at me from a Kool-Aid days or
druggy days or what but that fool sent a
wave in out of nowhere and then my
nephew
disappeared yeah I don't know if you've
ever lost a kid in the Pacific
Ocean but that's a bad feeling right
there yeah I only lost him for like 3
seconds it was the longest three in my
life I was searching for his head to pop
up like a buoy I was like come on Teddy
come on and I just seen him tumbling you
know and he's four he can't talk that
good he popped up and he said I was
underwater
uncle and he said I could see you and
then I couldn't see you and I said
you're a poet tatus now don't tell your
mom about this"
KnriVYkW3A0,https://www.youtube.com/shorts/KnriVYkW3A0,"""I can't fight dude."" 🎤: Jo Koy #shorts",,31000.0,Comedy Central Stand-Up,@standup,en,"I can't fight dude if you don't know how
to fight here's the thing don't take
self-defense classes don't buy a gun
don't do anything just just
scream who's going to fight a guy
screaming at the top of his lungs like
right when he's about to punch you just
[Applause]
no
he's going to f a guy screaming like a
[ __ ] I'll pull my pants down and start
peeing
St I am a [ __ ] dude I don't care you
guys are laughing but you're thinking to
yourself that might work"
FNddTwBis_Q,https://www.youtube.com/shorts/FNddTwBis_Q,"""Girls are trying to be perfect.""🎤: Tammy Pescatelli #shorts",,30000.0,Comedy Central Stand-Up,@standup,en,"there's just like this whole generation
especially girls are trying to be
perfect you don't have to be perfect do
you know that like men don't try to be
perfect for us we they don't what do you
guys we're lucky if they
shower and trying to be perfect will get
you in trouble cuz I had a neighbor who
got to silicone to Tony and one got hard
just one like a rock then you can't
swim just keep flipping
over I think that's why they canceled
Baywatch right
cuz those broads are scaring people is
that a shark no that's unibob leave her
alone she"
Oh2r8CyJRVc,https://www.youtube.com/shorts/Oh2r8CyJRVc,"""I've been in the gym...""🎤: Taneshia Rice #shorts",,26000.0,Comedy Central Stand-Up,@standup,en,"it's so expensive to eat healthy I've
been in the gym you know I got to lose a
little weight been in the gym eating
healthy thank you yeah it's been working
out it's four months I joined the gym
four months ago I swear to God I stepped
on scale yesterday and in four months I
have lost 45 yes hello yes in four
months I have lost
$45 okay that's what the [ __ ] okay have
not lost a pound do you hear me but but
the money falling off my ass yes I'm
losing 15 a month quick Quick Quit you
know they take that [ __ ] right out your
bank account right don't do that LA
Fitness okay you don't know if it's in
there okay like you don't do that like
y'all not going to take attendance first
I'm not here damn I've been
absent all right I've been absent stop
charging me okay yeah I'm not using this
[ __ ] run the
tapes run the tapes you ain't seen me
since December okay
like put that [ __ ] back in my account"
qoeLTIVQs74,https://www.youtube.com/shorts/qoeLTIVQs74,“My first dream was to make it to the NBA...” 🎤: Chinedu Unaka #shorts,,58000.0,Comedy Central Stand-Up,@standup,en,"my first dream was to make it to the NBA
obviously I didn't get there I'm here
with you
tonight but that was the plan I think a
reason I didn't get there I went to
public school my whole life and a lot of
public schools don't got real coaches
but we don't realize this as kids we
just trust a person in front of us
they're not trained it's just teachers
with free time that's all it is you know
the only thing I could compare to you
ever been inside of a club and you see
security and you look him in the eye you
could tell he ain't got no
moves just a black man in a polo you
know what I
me it hit me when I started teaching
high school out of nowhere they ask me
to coach the soccer team now let me be
clear about something I don't know [ __ ]
about soccer but they really needed me
and I said yes and I was going to do
research but you put that whistle on it
changes you I said [ __ ] that research
I'll make the rules you know stop
kicking the ball man throw it in the
net"
xCmJTLUSiAM,https://www.youtube.com/shorts/xCmJTLUSiAM,"""I tried to listening to heavy metal..."" 🎤: Asha Ward #shorts",,31000.0,Comedy Central Stand-Up,@standup,en,"I tell people I'm a lesbian just cuz
that's easier than saying them into like
women and DJs who don't speak you
know and I was raised Catholic but I
feel like if God was real white people
wouldn't have access to
ulele that's just where I'm at with
it I tried listening to heavy metal for
the first time the other
day immediately turned it
off you will not yell at me in my own
home"
6WJ6ID8fvGs,https://www.youtube.com/shorts/6WJ6ID8fvGs,"""This year my goal is to black out less.""🎤: Sheng Wang #shorts",,52000.0,Comedy Central Stand-Up,@standup,en,"this year my goal is to black out
less it's a very difficult goal to
track I think I'm succeeding but I might
just not remember
failing I recently went out with my
girlfriend I decided she was going to be
the designated driver but I did not
bother to tell her about my decision
I just went ahead and got crazy
sloppy because actions speak louder than
gibberish it got to that point where
forget about driving folks forget about
driving I might not make the cut as a
passenger"
UByvVQURYE8,https://www.youtube.com/shorts/UByvVQURYE8,"""I was trying to do diet and exercise..."" 🎤: Jo Firestone #shorts",,34000.0,Comedy Central Stand-Up,@standup,en,"I was trying to do diet and exercise
have you guys tried
that it's terrible it's so terrible it
goes against every evolutionary progress
we made which is to eat and sit
still it's so terrible I hate diet and
exercise I hate there's if you go to a
gym has anyone been to those it's so
terrible there's all these things where
you don't know where to put your hands
or feet there are so many rules and no
one explains it to you they just give
you more
towels it's so terrible I I tried I
tried exercise I didn't realize that you
needed to wear a sports bra and I almost
ripped my tits
off so heard the tearing I was like I
got to sit down"
aKm7EeAMFAc,https://www.youtube.com/shorts/aKm7EeAMFAc,“Is the mark of a good party always something bad happening?” 🎤: Josh Johnson #shorts,,68000.0,Comedy Central Stand-Up,@standup,en,"is it just me or is the mark of a good
party always something bad
happening you know no one's ever like oh
my gosh that was a great party last
night we all drank just enough got home
safe and woke up in time for
breakfast that's never the description
ever it's always like great party Bill
died great
party that's a fantastic party somebody
need to call Bill mama he did I don't
talk to Bill like that but great party"
UynEHJZUIjg,https://www.youtube.com/shorts/UynEHJZUIjg,“It's the moonshine of medicine.” 🎤: Lewis Black #shorts,,74000.0,Comedy Central Stand-Up,@standup,en,"I like a cold though because I get to
take my favorite drug which is
NyQuil I love that stuff what's the
matter with the rest of you what do you
take robotussin non-narcotic
pansy nwell is 180 proof it's the
Moonshine of
medicine why would you bother with
anything else there's a daytime NyQuil
there it's a nighttime NyQuil drink
either one you want okay cuz your cold
doesn't care what time it is"
mDVMZRZE76U,https://www.youtube.com/shorts/mDVMZRZE76U,"""I spent the day in bed with my life partner again.""🎤: Chelsea Handler #shorts",,60000.0,Comedy Central Stand-Up,@standup,en,"I spent the day in bed with my life
partner again her name is Kettle one
and we were talking about why I'm still
single and we basically came up with
three reasons as to why I have nothing
to offer anybody number one is I can't
cook and I'm not looking to learn
ass
okay I don't know how to clean you know
there's a good chance I may be an
alcoholic think guys would be a little
bit more excited about that all they do
is and moan you drink too much you
sleep too
much it's like if you were drunk all the
time you'd be tired too"
AG9CtaMRfuM,https://www.youtube.com/shorts/AG9CtaMRfuM,"""What's the theme?"" 🎤: Moses Storm #shorts",,23000.0,Comedy Central Stand-Up,@standup,en,"same kind of like creepy and sweet as
like when like PornHub around December
will like upload like Christmas theme
porn and you're like
oh wife is that for
who it's like jiz the season
what who the is that for anyone in this
room like H jerking off feels great but
what's the
theme"
u0g8Yb248YQ,https://www.youtube.com/shorts/u0g8Yb248YQ,“Black people are actually pretty split on Kwanzaa.” 🎤: Josh Johnson #shorts,,82000.0,Comedy Central Stand-Up,@standup,en,"for all the white people that don't know
black people are actually pretty split
on Quanza like half of us celebrate and
half of us are like yeah I know K Quanza
all right she got a fight with my sister
I had to pull her weave out okay what'
she say she say something did she say
something
though"
dhYBI3xzu4o,https://www.youtube.com/shorts/dhYBI3xzu4o,"""We still haven't taken down our Christmas decorations."" 🎤: Dan Mintz #shorts",,137000.0,Comedy Central Stand-Up,@standup,en,"my family is really bad about
procrastinating we still hav been taking
down our Christmas
decorations and it's been three
generations since we converted to
Judaism"
NIzucBcvAOI,https://www.youtube.com/shorts/NIzucBcvAOI,"""The Crimp and Curl Pony, I wanted it."" 🎤: Joel Kim Booster #shorts",,22000.0,Comedy Central Stand-Up,@standup,en,"for the sake of my story I was a pretty
gay kid uh and it was never more
apparent to me or my family than
Christmas
1994 I wanted what every little boy in
the nation wanted for Christmas that
year say it with me the crimp and curled
pony by the Cabbage Patch company okay
um again left hanging uh whatever the
crimp and curl Pony I wanted it my mom
was super cool she got it for me I open
it up on Christmas morning I just
started crimping and curling right away
you know couldn't resist my dad less
enthused uh
he looked at my mom and he was like
Janet what the [ __ ] like this is a girls
toy this is a toy for little girls why
would you get him this and my mom looked
at my dad in his eyes and said well Ken
my brother Bob he used to get baby dolls
for Christmas and now he's a
pediatrician
so connect the
dots and I was and my dad was just like
what the [ __ ] do you think he's going to
be a [ __ ] horsehair stylist like
what's the end game here Janet"
