video_id,url,title,duration,view_count,channel,channel_id,language_code,transcript
B2AtsG8nSVI,https://www.youtube.com/shorts/B2AtsG8nSVI,“Normalize being a bad b**** with depression.” 🎤: Rebecca O'Neal #shorts,,195000.0,Comedy Central Stand-Up,@standup,en,"I will get real with y'all though over
the pandemic it's the first time in a
long long time I've thought about
getting back on antidepressants okay I
haven't been on the entire person in a
decade I'm older than you think do not
ask okay I told my friends this and they
were really supportive they just had a
few questions like okay you're on
antidepressants before what did it feel
like like why do you want to get back on
them and I was honest being on
antidepressants feels like your brain is
being gentrified that's what it feels
like
it really does but like the property
value is going up but I don't recognize
this place like
where's the liquor store who fixed the
sidewalk finally wow okay interesting
there's white women jogging around my
brain at night streets are dead"
pgJkmLMfQvY,https://www.youtube.com/shorts/pgJkmLMfQvY,“People ask me what it was like to be raised by white people...” 🎤: Skyler Higley #shorts,,1200000.0,Comedy Central Stand-Up,@standup,en,"I was adopted by uh white people as a
baby that's half of what's wrong with me
people ask me what it was like to be
raised by white people I'm like I don't
know I have fun
right I'd get in trouble I'd be like ah
you can't hit me that's a hate crime you
know
my dad's like give me my belt I'm like
give me y'all Sharpton what you
trying to do
they try to send me the time out be like
go to timeout I'm like oh interesting
did you know that a disproportionate
amount of the people incarcerated within
timeout in this household
oh
African Americans
here's the thing about white parents
nobody tells you
white parents hate it when you sing
Negro spirituals
just because you have to do chores they
hate that
straight up"
rBP_Vs1lnI8,https://www.youtube.com/shorts/rBP_Vs1lnI8,“That Plan B pill is expensive.” 🎤: Caitlin Peluffo #shorts,,46000.0,Comedy Central Stand-Up,@standup,en,"yeah that Plan B pill is expensive am I
right huh
you're all [ __ ] judging me okay
it's pricey it made me late on rent
I was having sex with a lot of DJs can't
be too careful
I know I was Queen of Bushwick anyway
I remember this one time right before my
boyfriend okay I was having sex with
this gentleman without a condom because
I'm fun okay thank you I have HPV Okay
so
we were having sex and he stops me
mid-sex he stops me he goes Caitlyn can
I just finish inside of you and give you
fifty dollars
I said yes okay
of course I said yes come on I just got
that IUD that's all profit okay
that's rich [ __ ] money all right"
1_qA49U1zyg,https://www.youtube.com/shorts/1_qA49U1zyg,"""My friends are happy that I'm in therapy."" 🎤: Aminah Imani #shorts",,71000.0,Comedy Central Stand-Up,@standup,en,"my friends are happy that I'm in therapy
my friends are excited I could tell when
I call them I'm trying to vent talk to
them about problems they get straight to
it they be like well what did your
therapist say about this
oh don't be cheating don't be a lazy
friend you know I need a second opinion
she's like
foreign
foreign"
0EpibqebPHI,https://www.youtube.com/shorts/0EpibqebPHI,"“Kale is a superfood, and its special power is tasting bad.” 🎤: Jim Gaffigan #shorts",,134000.0,Comedy Central Stand-Up,@standup,en,"can we stop with the kale propaganda
[Applause]
pray
looking at a can of bug spray it said
made with real kale
is
listen it's inedible all you have to do
is freeze dryer covering cayenne peppers
put in the shake and bear it in the
ground
cow is so good for you it's like a
really bitter spinach with hair
Kell is so good for you they could find
out kale cures cancer and I would still
be like I'm just gonna do the chemo all
right
I've tried the chaos
[Music]"
oOt7YpyNedA,https://www.youtube.com/shorts/oOt7YpyNedA,"""I can tell that I'm getting older..."" 🎤: Ali Wong #shorts",,100000.0,Comedy Central Stand-Up,@standup,en,"I can tell that I'm getting older
because now whenever I see a 21 year old
girl my automatic thought is [ __ ] you
[ __ ] you I don't even know you but [ __ ]
you cause I'm straight up jealous
because 21 year old girls they got that
ripe ass body where they could just eat
like [ __ ] and then they take a [ __ ] and
have a six-pack
right and they got that inner thigh
clearance where they just put their feet
together and there's that Gap here with
the light of potential just radiating
through
I'm a small person but I don't even have
that anymore because it's all closing
for business
foreign"
xRYHbrpTBZ8,https://www.youtube.com/shorts/xRYHbrpTBZ8,“Cubicles should be illegal.” 🎤: Bill Burr #shorts,,285000.0,Comedy Central Stand-Up,@standup,en,"and I realized that was too stupid to
run a business
you know what I mean I just knew I was
never going to be that guy in like you
know in the big
office big long table going we know we
in the fourth quarter we need to
increase increase production okay Kathy
you're using a little bit too many paper
clips and we need to just kind of tone
that down not single you out we're just
kind of
I could never do it so I realized the
only thing I could ever do my greatest
thing could ever do was work on one of
those cubicles
and I refuse to do it
cubicle should be illegal man you know
what a cubicle basically says it
basically says like you know what we
don't think you're smart enough for an
office but we don't want you to look at
anybody
hunched over typing away around lunch
time you pop your head up like a gopher
like hey Steve you want to get a
sandwich I said get in there
in their face"
pHpSJ-Ylpwo,https://www.youtube.com/shorts/pHpSJ-Ylpwo,"“I’m a tomboy, and he is a small, effeminate man.”🎤: @caitlinpeluffo #shorts",,1600000.0,Comedy Central Stand-Up,@standup,en,"we've actually we've been living
together for a while so I call him my
partner all right that's what I call him
he's my partner and he hates it
because I'm this I'm a tomboy and he is
a small effeminate man
so every once in a while someone will
just get a little too woke you know I'm
like over there that's my partner Steve
and someone will be like oh
are they happy
how are they doing and I'm just like
they're great and he's just off in the
corner like tell him I'm a boy
thank you
and I have to be like ah true Ally
wouldn't care come on you're not gonna
marry a bigot also stop wearing v-necks
that's on you"
lu0GJn8NipA,https://www.youtube.com/shorts/lu0GJn8NipA,"“Islam, I think, we have bad P.R.” 🎤: Fahim Anwar #shorts",,122000.0,Comedy Central Stand-Up,@standup,en,"Islam I think we have bad PR
right like even me just saying Allah
Akbar
some white people are nervous right now
because in the movies whenever someone
says Allah Akbar bad stuff happens
so I've been trying to give us a
facelift
what I've been doing I've been walking
around town performing random acts of
kindness
while yelling Allah Akbar
so I'll open up a door for an old white
lady
come on
[Applause]
she's like what a sweet young man"
hQxYA4R5D6g,https://www.youtube.com/shorts/hQxYA4R5D6g,“Who the f**k likes who they used to be?” 🎤: Emil Wakim #shorts,,80000.0,Comedy Central Stand-Up,@standup,en,"been going home a bunch and uh it's fine
you know yeah right it's home that's
what home should feel like right just
just old you right like
if you grew up correctly home should be
like a region of the country that
reminds you of the shittiest version of
yourself that's
what home should be like if you drive by
your high school and you're like no
hey we do not need you anymore like I
was driving in my hometown and my friend
was like no that's the parking lot that
I learned how to drive in I was like
that's crazy because that's the parking
lot that I hooked up with my high school
Crush in couldn't get hard and then said
I love you that's
likes who they used to be ew"
SPoz0kcw0vE,https://www.youtube.com/shorts/SPoz0kcw0vE,“I was running late as usual…” 🎤: Ed Helms #shorts,,151000.0,Comedy Central Stand-Up,@standup,en,"[Applause]
oh cool I'm actually a little bit
frazzled I got to tell you uh on the way
over here I was running late as usual
and uh I got the I was sprinting down
the sidewalk and I got to the subway
station and I run down the stairs and I
hear my train pull up like yeah I can
get through the turnstile I Sprint down
the stairs Sprint down the platform make
it in the train last second
[Applause]
and the doors don't close for like five
minutes
hey
how's it going yeah no I totally thought
the doors are going to close that's why
I ran yeah"
bW1U_QlvANo,https://www.youtube.com/shorts/bW1U_QlvANo,"""I'm actually a back-up nanny."" 🎤: Liza Treyger #shorts",,77000.0,Comedy Central Stand-Up,@standup,en,"no but I don't like hate kids like I'm
pretty into kids I'm actually a backup
Nanny no big deal
um
it's pretty fun a backup nanny is like
if the nanny can't come to work I come
to work it's pretty cool people are like
you're an American hero I'm like come on
stop uh
but I love it because kids are just like
so easy to entertain you know like I
always bring bubbles when I meet a new
kid it's kind of my thing and like kids
with bubbles are the best they're just
like jumping twirling giggling shrieking
shrieking for bubbles for me to be that
happy I'd have to be eating brie cheese
watching The Mindy Project and getting
furiously fingered yeah"
AxPVZ2qCago,https://www.youtube.com/shorts/AxPVZ2qCago,“Be proud of what your mama gave you.” 🎤: Bridget Everett #shorts,,93000.0,Comedy Central Stand-Up,@standup,en,TranscriptsDisabled
QeRISqwMkbY,https://www.youtube.com/shorts/QeRISqwMkbY,"""My problems are so metaphorical and not literal."" 🎤: Emil Wakim #shorts",,253000.0,Comedy Central Stand-Up,@standup,en,"my parents they have no idea what I'm
going through you know and I don't mean
like it's not like they can't like grasp
the severity of my problems I mean like
my problems are so metaphorical
and not literal that they just they
genuinely have no idea what I'm
talking about
they just have to round up to the next
closest thing they think it could be
they try to be there for me they're like
what's going on what's wrong and I'm
like I don't know I just sometimes I
feel like I'm never like happy with like
with like the moment you know like my
whole life I'm just like worrying that
something isn't gonna work out the way I
want it to or even if it does and I have
the thing I've always wanted then I just
start thinking about how I tricked
people to get that or how I don't
deserve it or how it has to end soon
because because everything has to end so
so I'm just worried I'm like living this
life where I'm just finding things to
get me through the day and I just I
don't want to live like that anymore
like I just want to be I just want to
 be and my dad is like
you are gay"
oFeu2c6TB0A,https://www.youtube.com/shorts/oFeu2c6TB0A,"""That's just not how names work."" 🎤: Mohanad Eshleishky #shorts",,159000.0,Comedy Central Stand-Up,@standup,en,"like it's it's Muhammad and he was like
huh interesting
you know actually here in the states is
pronounced Muhammad
like oh cool well that's a great Point
uh it's just not how names work yeah
yeah they don't change based on location
you know because if your name is Miles
and you travel and you go to France no
one is going to come to you and be like
actually here it's pronounced kilometers
yeah"
agq4WKb53mA,https://www.youtube.com/shorts/agq4WKb53mA,“I feel like I’m a little catfish.” 🎤: Tina Friml #shorts,,1100000.0,Comedy Central Stand-Up,@standup,en,"I feel like I'm a little
catfish
so all we need all the bios of all these
tender guys okay it's not my fault I
read the BIOS okay all right all the
biomes say that all these guys are
open-minded
and I'm like down for whatever
what's up
I used to think down for whatever was a
green light for me
I come to my yard I don't so much need a
guy who's down for whatever but more a
guy who's up for something very
particular"
5C_OD4k8nJo,https://www.youtube.com/shorts/5C_OD4k8nJo,"""Find me a part of America that's not racist. I'll move today."" 🎤: Dulce Sloan #shorts",,3400000.0,Comedy Central Stand-Up,@standup,en,"oh you must be so glad to be in New York
the south is so racist the south is so
racist oh
you mean the part of the South that
starts to Canada is that Mexico
find me a part of America that's not
racist I moved today
I'll wait
I know the north is more racist because
in the north they split up white folks
they got Italian neighborhoods
Irish neighborhoods I live in a Greek
neighborhood
you know what Irish and Italian and
Greek is in the South White
nobody has time to break down your brand
of whiteness okay
I don't care what flag your Caucasian
flies under Brandon"
jWOa6GFurxE,https://www.youtube.com/shorts/jWOa6GFurxE,“I’ve come here tonight to get drunk and talk about love.” 🎤: Bridget Everett #shorts,,74000.0,Comedy Central Stand-Up,@standup,en,"foreign
[Music]
[Music]
[Music]
Lodge
below
[Music]"
NK2Pt29fG6M,https://www.youtube.com/shorts/NK2Pt29fG6M,"""I'm your only fan."" 🎤: Reggie Conquest #shorts",,68000.0,Comedy Central Stand-Up,@standup,en,"what I do during the pandemic I I did
subscribe to two only fan accounts
anybody else
you support women
subscribe the two and cheap you know
they don't got a lot of followers I
don't do the millions and thousands of
followers I'll do two three thousand
followers just in case I run into them
goes
it's me
I'm your only fan"
0kZeRdd7hgg,https://www.youtube.com/shorts/0kZeRdd7hgg,“I’m like the bisexuality of ability.” 🎤: Tina Friml #shorts,,6400000.0,Comedy Central Stand-Up,@standup,en,"so I am disabled um don't worry you're
going to be
okay lock the
doors I know I I know I I know I
know so
hard I know I'm kind of confused and I'm
like half and half I'm not like totally
committed
[Applause]
lifestyle I'm like the bisexuality of
ail"
o2mB30WAEA0,https://www.youtube.com/shorts/o2mB30WAEA0,"“Every night, it’s like getting it ready for its first quinceañera.” 🎤: Amy Schumer #shorts",,94000.0,Comedy Central Stand-Up,@standup,en,"it's worth having a vagina that's work
guys don't think that it's work but it
is you think it just shows up like that
to the event it doesn't
every night it's like getting it ready
for its first quinceanera believe me
it's a lot of work it didn't used to be
work I know that from watching vintage
porn it was no work
zero I even I remember my mom bottomless
when I was a kid and it was just
it looked like the black smoke monster
from Lost was
is mom being swarmed by bees what is
and then something happened I don't know
like 10 15 years ago all the dudes got
together and had like a meeting
like a fantasy football draft about our
privates
they were like we can't get in there
it's like Vietnam trying to"
Ujy78MfCNJE,https://www.youtube.com/shorts/Ujy78MfCNJE,"""I grew up playing football..."" 🎤: Aaron Weber #shorts",,115000.0,Comedy Central Stand-Up,@standup,en,"I played football growing up I played
football for the YMCA
that was our league that was all we had
if you want to play football you played
for the Y in your neighborhood that's
how they divvied up the kids you played
for the YMCA closest to your house so
what that means in Montgomery Alabama
where I grew up is that some teams are
all white and
yeah some teams are all white and some
teams are incredible dude that's what
happened
out there
I don't think I ever won a game but I
built some character you know"
Voo-uF9BIoE,https://www.youtube.com/shorts/Voo-uF9BIoE,"""It's very manly when a guy plans a date."" 🎤: Mark Normand #shorts",,361000.0,Comedy Central Stand-Up,@standup,en,"yeah I learned the hard way too that
girls like when a guy has a plan ready
for the day he's got something planned
out which how did guys get stuck with
that chore
right I had a girl ask me out once we
show up we meet
she's like hey what are we doing I'm
like I don't know what are we doing
she's like you didn't play anything I'm
like no did you she's like no I'm like
well then you're just as worthless as me
why do I have to figure it out I believe
in equal rights can we work on this
together and she was like well it's very
manly when a guy plans a date no it's
not just convenient for you
how's that manly chopping wood is manly
wrestling a bear is mainly there's
nothing manly about Googling topless and
bistros
come on ladies you got the right to vote
in 1920 let's use that on restaurants
huh I don't know where to go because I
have a dick I'm Zagat help me out what
the hell
manly come on I've noticed women only
call things manly when they like it
about a guy oh he pays for dinner he
protects me and stuff like oh he wants
to bang my friends going baldy so manly
ah"
0XLxjpOYiUQ,https://www.youtube.com/shorts/0XLxjpOYiUQ,"""The last job I had, I got through a temp agency..."" 🎤: Martha Kelly #shorts",,120000.0,Comedy Central Stand-Up,@standup,en,"I used to work in offices a lot and the
last job I had I got through a temp
agency they called me on a Friday and
said they had an assignment for me
starting the following Monday and it had
been a while since I worked in an office
so I thought I should probably do
something over the weekend to prepare to
get back into all the typing and filing
and phone answering and whatnot so what
I did is I had a friend of mine go with
me down to the local swimming pool and I
had him tie me up in a burlap sack and
sync me to the bottom of the pool
and then right when I was about to
suffocate he yanked me up and gave me a
lunch break
and then hello"
yDe2b_qlsng,https://www.youtube.com/shorts/yDe2b_qlsng,“We should stop calling all of weed ‘weed.’” 🎤: Josh Johnson #shorts,,10000000.0,Comedy Central Stand-Up,@standup,en,"should stop calling all of weed weed now
we have like eight levels of weed deeper
than anyone has ever had before that
needs a new name
you know like my friend took an edible
and then just leaned in the corner for
30 minutes
because he thought he was a glass of
orange juice
and he didn't want to spill himself that
is not weed sir"
hu9xC1suTUQ,https://www.youtube.com/shorts/hu9xC1suTUQ,"""Keep truckin'."" 🎤: Aaron Weber #shorts",,144000.0,Comedy Central Stand-Up,@standup,en,"I have sleep apnea I have to wear a CPAP
machine and my doctor when he diagnosed
me he goes don't worry you know not
everyone that has sleep apnea sleep
apnea is not always weight related
well thanks
um because was it rate related with me
he was like oh yeah yeah for sure
for sure
people have sleep apnea there's nothing
to say you're not concerned or surprised
so it's just I get a lot of all right
that's I like that there's nothing to
say I was on a plane once sometimes I
fly with it in like a special case and
the guy sat down next to me and he goes
what is that I go it's a CPAP machine I
have sleep apnea and he just goes
keep trucking you know
I'll be honest I was like oddly powerful
I think about that a lot that was three
years ago do you know how many times a
week I tell myself to keep trucking"
Vsq4fEyeTng,https://www.youtube.com/shorts/Vsq4fEyeTng,"""I'm gonna be a hero."" 🎤: Steph Tolev #shorts",,70000.0,Comedy Central Stand-Up,@standup,en,"I'm on the Main Street there's a loose
dog running a buck I'm like
the middle of the street chasing a dog
it's like a refrigerator got loose she's
chasing a dog in the other day it was a
lot
very close cars are honking everyone's
quite worked up bit of a traffic jam get
raped by the dog lock eyes I'm like
don't move [ __ ]
cop goes by rolls his window down goes
hey idiot
idiot me he said yeah
stop chasing that coyote
I chased the coyote for 15 minutes had
no [ __ ] clue
you guys ever seen a coyote before very
sick looking dog if you're wondering
what it looks like very ill Animal Fairy
balls several open sores on its back
tough to hair right here nowhere else
spook me
I had it snuffed I'm not gonna make that
mistake again
I sleep with that coyote closest thing
I've had to relationship in years it's
sad it is it really is"
YoW78nGapZE,https://www.youtube.com/shorts/YoW78nGapZE,"""I love tax time."" 🎤: Michael Che #shorts",,1700000.0,Comedy Central Stand-Up,@standup,en,"I've had taxes taken but I've never paid
taxes and that's two totally different
things when you have taxes taken you get
a job every week and they just take the
taxes out of your check they just take
it you don't get a choice just take it
and they keep taking it to the end of
the year where they're like hey I think
we might have took too much
his 500 back go buy yourself some
sneakers or something
and you're like thanks government we're
going to Red Lobster tonight this is
amazing
I love tax time
when you pay taxes it's totally
different when you pay tax they let you
keep all of your money all year and at
the end they say you owe us 40 percent
which is a lot for me because I don't
know what I'm paying for I've never
dialed 9-1-1 I put out all my own fires
thank you"
NqVxhoi3Yss,https://www.youtube.com/shorts/NqVxhoi3Yss,"""I love Uber eats."" 🎤: Dauood Naimyar #shorts",,62000.0,Comedy Central Stand-Up,@standup,en,"I love ubereats I've been doing it
eating a lot of drinks lately because my
life is pretty good and
I ordered it recently and uh
I get a message in the app and it's like
this super eats is going to be delivered
by an autonomous vehicle
right like I have social anxiety I'm
gonna make small talk with a thing I'm
like paranoid what's gonna happen I
don't want to deal with this
I show up it's a robot easiest
transaction ever I get my cultural food
Mexican and
go back to my apartment start eating my
burrito and I look at the app again and
it's asking for a 20 tip
I'm not tipping these goddamn robots
y'all
well I got super jump to give that robot
a little wage it's not my problem
I still tipped I was afraid I don't know
I don't know what gen Z's gonna be like
I don't want to be shamed by them you
know
I don't want them to like write a blog
like these millions are not tipping
these robots these goddamn bigots you
know like I don't
I respect robot rights if you're here
you know what I'm saying"
jpZJWI3Sbt8,https://www.youtube.com/shorts/jpZJWI3Sbt8,"""Not fun being an introvert."" 🎤: Mark Normand #shorts",,283000.0,Comedy Central Stand-Up,@standup,en,"an introvert introverts here
hey all right you guys rarely speak up
yeah
not fun being an introvert you know you
just gotta get out there and fake it
yeah hard round people most people like
me around people for us it's like it's
work it's tough like this is an
introvert's biggest fear right here
you're hanging out with some guy I don't
really know you're like all right man
good hanging out I'm gonna take the
train home this guy goes oh yeah what
train you taking
uh I was gonna take the number six hey
me too [ __ ]
damn it back on the clock"
RWhLFo2Otog,https://www.youtube.com/shorts/RWhLFo2Otog,"""Who are we to command God to bless somebody else?"" 🎤: Dina Hashem #shorts",,63000.0,Comedy Central Stand-Up,@standup,en,"I was on the train and this woman
sneezed and this man said God bless you
to her and she didn't say anything
he said it again just in case you didn't
hear like hey God bless you still
nothing
he physically tapped her on the shoulder
I was like hey God bless you and she
finally begrudgingly was like okay thank
you and I was trying to understand why
she wouldn't just say thank you
but then I started thinking about the
phrase God bless you and it's kind of a
paradox right like who are we to command
God to bless somebody else
and if we could then we would be gods
and religion would be useless in the
first place
so maybe she realized that
and didn't want to be complicit in that
kind of hubris yeah
[Music]
or maybe she's a [ __ ] I don't know"
Hvv0Oayohi4,https://www.youtube.com/shorts/Hvv0Oayohi4,“You know how drunk you have to be to lose your phone 30 years ago?” 🎤: Mark Normand #shorts,,546000.0,Comedy Central Stand-Up,@standup,en,"my uncle is actually 30 years sober I
believe that 30 years sober yeah the
other night I was like oh man I got so
drunk I lost my phone my uncle's like oh
yeah I did that once
I was like wow you know how drunk you
have to be to lose your phone 30 years
ago
holy hell are you telling me you got a
hammer and lost a landline all right now
why do you quit boozing those were
attached to the wall"
EBN3DNZjppA,https://www.youtube.com/shorts/EBN3DNZjppA,“It wasn’t dope to be from Afghanistan.” 🎤: Dauood Naimyar #shorts,,644000.0,Comedy Central Stand-Up,@standup,en,"like I said I was born in America but my
family my sisters my parents everybody
all born in Afghanistan and something
happened in September of 2001 or uh
it wasn't dope to be from Afghanistan so
my mom she would tell me hey don't tell
people we're from Afghanistan all right
don't let them know your heritage
because they might hurt you there might
be violence towards you so lie
but she didn't tell me what to say
so I'll just tell kids I was from
Pakistan
[Laughter]
reaction uh
uh yo kids don't know the difference
still got harassed and bullied all the
time
well then I was like 13 or 14 I figured
it out I was like all right the stands
they're not working for me
I am now Mexican let's do this
foreign"
