video_id,url,title,duration,view_count,channel,channel_id,language_code,transcript
hT_inLillmA,https://www.youtube.com/watch?v=hT_inLillmA,Axel Blake's Beef With Dairy | Axel Blake: Comedy Central Live,59.0,30951.0,Comedy Central UK,@comedycentraluk,en,"anyone else lactose intolerant
feel it don't you yeah you know when the
doctor first told me I was lactose
intolerant I didn't know what it was I
sat the whole family down I was like
listen
[Laughter]
I don't know how long I got
I got lactose intolerance disease
my brother thoughts trying to come out
you're trying to come out I said no
the way my belly's bubbling right now
something's trying to come out
but it doesn't
understand he does it
isn't it risk and rewards that's what we
do I'm not leaving all the dairy for you
guys no obviously I'm sensible if I go
out you know I'll be like I ordered a
linguine please no parmesan but if I'm
at home the comfort of my own house and
the toilet's right there
I'll be drinking cheese and eating milk
in that order"
S_Q5c_ZGWMc,https://www.youtube.com/watch?v=S_Q5c_ZGWMc,Who The F**k Reviews Hospitals? | Andrew Ryan: Comedy Central Live,46.0,7148.0,Comedy Central UK,@comedycentraluk,en,"hospices are amazing places right with
great staff and great care great living
in a hospice as well and I remember when
I found out that she was going to the
hospitals I didn't realize like what to
do or how do you deal with this kind of
stuff and I didn't even know where the
hospice was so you know what I did I
Googled it right to find out where I was
and I swear to God I Googled it and
there was over a hundred reviews
things is a good idea
to review a hospice like restaurants and
hotels I could totally deal with but a
hospice I saw one review but mate John
went in for a week never came out two
stars
foreign
off your next day I don't think that's
gonna happen"
vlnrJr2jabg,https://www.youtube.com/watch?v=vlnrJr2jabg,"""Who Are These Urban Ragamuffins?"" 😂 | Comedy Central Live",53.0,4674.0,Comedy Central UK,@comedycentraluk,en,"i can say that it's fine
[Laughter]
the other one wearing a baseball cap
really low right can't see the face and
they're both there together bopping down
the street looking at the cars looking
at the houses and um i'm not gonna lie
i got alarmed right
that's never happened to me before i've
never seen black people go oh i've never
racially profiled my own bloody race
right
but on this occasion i was like look at
this riffraff coming down my street
who are these urban rugger muffins right
i'm not proud but i did a very middle
class thing i called a neighborhood
watch and i had them ushered away
i know it was wrong it was very
judgmental and to be honest my brother
and my stepdad were fuming
it's their own fault
i told him when you come to visit
wherever cardigan man blend in"
fz82U7CXhlQ,https://www.youtube.com/watch?v=fz82U7CXhlQ,A tincy tiny bit more judgement... that's all 🙄,54.0,7199.0,Comedy Central UK,@comedycentraluk,en,"now I realize I'm making a
generalization I understand that but I
think on the whole that this holds up
that mothers and sons very different to
mothers and daughters yeah if I was to
encapsulate that relationship mothers
and sons it would be like
this mommy loves you very
much no darling you don't do anything
okay because Mommy will do it for
you mommy thinks you're very special you
just go out and you achieve and you do
whatever you want because Mommy believes
in you now kisses for my very special
boy mothers and daughters is a bit more
like this you look fat in
that just saying there's a bit more
judgment there that's all I'm saying"
5anVwcEn5rA,https://www.youtube.com/watch?v=5anVwcEn5rA,2020 gave Taiwan it's moment to shine ⭐,45.0,3805.0,Comedy Central UK,@comedycentraluk,en,"I just want to say despite this Chinese
accent I'm actually not from China
you're looking at a beautiful citizen
from the beautiful island of
[Applause]
Taiwan yes I'm one of the good ones y
you know how they used to say Taiwan
China potato potato what's the
difference hey not after 2020 M now it's
more like Taiwan China star pupil
patience zero okay so I
will pretend I didn't say that uh
because they are listening and um"
gWzq6XZCCoc,https://www.youtube.com/watch?v=gWzq6XZCCoc,Now THAT'S showbiz! 🤩,60.0,5517.0,Comedy Central UK,@comedycentraluk,en,"okay Robbie Williams oh hello hello
Robbie Williams I don't know but I've
seen pictures in the gym and Marvin you
definitely have bigger
boobs that wasn't the question
Robbie I like that that's good that's
good all right Danny Jones McFly
everybody's famous in your
life Danny Jones from mfly says no Humes
I would say rock
is far more famous oh dear PS have you
sorted your
rash I mean have you is it
okay D Daddy and I play football
together so we see each other in the
shower sometimes
that's all better now see you in the
showers next
week"
DF78-4qNyFQ,https://www.youtube.com/watch?v=DF78-4qNyFQ,The twins in the womb: 😲😟🤐,55.0,2215.0,Comedy Central UK,@comedycentraluk,en,"a
[Music]
[Laughter]
woman said boys are better to
me another
woman in front of another woman
and her
daughter yeah do you know what I felt
like saying to her I felt like saying to
her look sweetheart do you see these two
unborn Boys in here well they're already
a disappointment to me yeah because I
wanted a daughter have a look at that
haircut love that should be an
indication as to how much I give a about
[Laughter]
[Applause]
boys I didn't say that I said it was
lovely to meet you and good luck with
your LOF conversion"
8VClpNisw-I,https://www.youtube.com/watch?v=8VClpNisw-I,People don't deserve pets... 🦜,60.0,2567.0,Comedy Central UK,@comedycentraluk,en,"she's got a bird the bird essentially
lives in a cage however she lets him out
but he cannot fly because like a lot of
bird owners she had his lower Wings
clipped yet she named him
Freedom how much Freedom does his bird
have and then she feeds Freedom people
food we had gone shopping we're rushing
to get back to her place so we went to
the drive-thru at KFC we get back to her
place she always pulls the bird she
always has the bird on her lap and she
talks baby talk to the bird she's like
oh free free free oh I love my fre next
thing I know she starts feeding the bird
some of her food I was like H what are
you doing she's like what I'm feeding my
bird I said you're feeding your bird
bird this has got to be cruel to the
animals she's like well my vet says it's
okay I was like well I don't want to
know what you got your feet in that damn
dog"
kcQpF5FMuYw,https://www.youtube.com/watch?v=kcQpF5FMuYw,Halloween just got a whole lot scarier 👻,52.0,4824.0,Comedy Central UK,@comedycentraluk,en,"I think the worst time to get amnesia
would be like
Halloween what is your
name I don't
know but I'm pretty sure I'm a
hobo who's got a sweet
tooth I wonder if there are any Goths in
Gothic
times you're like you look completely
appropriate you don't look stupid or
lonely at all
I was in this building and there's a
door and on the door it said this door
must remain closed at all
times I was like dude you're thinking of
a
wall that is a waste of a door what are
you doing"
gi67O4QnUss,https://www.youtube.com/watch?v=gi67O4QnUss,"No weekly shoppers here, thank you very much 🚫🤨",52.0,1256.0,Comedy Central UK,@comedycentraluk,en,"I think class is way more interesting
than race like give me a cheer if you're
working
class who let you
in N Comedy Central I told you I told
you I only performed to people who shop
at little
ironically none of you weekly
Shoppers I'm old enough to remember when
those shots first started spreading
around the country we didn't used to
have them everywhere right and I
remember when they first started open
opening them middle class people would
go to them and then write 500 words for
the guardian the next
day they say things like oh my gosh I
went to little and tried the peanut
butter and it was just the
same as the waitrose peanut butter"
Tk-xU6Gvrq4,https://www.youtube.com/watch?v=Tk-xU6Gvrq4,Couples Should Go To Therapy Not IKEA | Comedy Central Live,55.0,4826.0,Comedy Central UK,@comedycentraluk,en,"it's an odd shopping experience Ikea
because you go for a wardrobe but you
leave with a drawer divider a garlic
Crusher 2000 tea lights a rug a jug a
divorce and some meatballs and it's just
it's just full of couples arguing in
there and I didn't know why before I
went now I know why because what happens
is you go in and you're walking around
and you're discussing stuff as you're
looking at things and as you're
discussing stuff you're slowly realizing
that you and this person that you've
chosen to share your entire life with
have nothing in common you know
for example it might be the big stuff it
might turn out that you don't really
like the cushions with the little
pom-poms on the corners and it might
turn out that she doesn't really like
your family
sort of thing that comes out you're not
quite sure about orange for the bedroom
she hates the way you breathe"
GuMPaVyDRls,https://www.youtube.com/watch?v=GuMPaVyDRls,Lasagna-economics based polyamory is the way to go 🍝,34.0,1961.0,Comedy Central UK,@comedycentraluk,en,"I was trying to sort of think about
whether I have a type in women and I
realized I've only ever dated women that
are sort of significantly smaller than I
am and I was trying to think why and
then I realized it's because um small
women never finish their
dinners uh so when I'm in a relationship
I'm eating like 125% of my usual
capacity and that really works for me um
is the only reason that I've ever
considered
polyamory so I could just sort of like
go around my girlfriend it's like a cat
going around the neighbors begging for
food one less an you for me please
girlfriend number four thank
you uh"
3wzKPGKvP0A,https://www.youtube.com/watch?v=3wzKPGKvP0A,Nothing worse than a racist earworm 🐛,40.0,11240.0,Comedy Central UK,@comedycentraluk,en,"uh yeah it's great the UK what a great
place I remember one of my first
instances of racism I still remember
quite well I was quite young I was
walking home from school and there was
this boy and a girl stopped me they
started singing at me they started
singing that one line from that one song
chicky China the Chinese chicken just
over and over again directly at me and
the most annoying part about that was
it's just so
catchy it's so catchy it's annoying when
you get a song stuck in your head it's
even when that song is direct racial
abuse like at least call me maybe isn't
a hate crime"
Dk-NpnI-ovw,https://www.youtube.com/watch?v=Dk-NpnI-ovw,Beware of the village weirdo... 👀,60.0,6238.0,Comedy Central UK,@comedycentraluk,en,"it's pretty amazing that you've you
managed to sell this kind of stuff to uh
to audiences I what do you mean by that
because it's difficult and
odd question number 21 finish this
phrase put another dollar in the swear
jar very quickly please thank you you
off question number six if I took away
all of the eggs but left you with some
of the eggs how did I take all of the
eggs and why do I need so many
eggs in Mexico
some people in the village think that
Pablo is a weirdo
[Music]"
KFyUSUqbMW4,https://www.youtube.com/watch?v=KFyUSUqbMW4,There's being famous and there's 1970s famous!,45.0,1531.0,Comedy Central UK,@comedycentraluk,en,"obviously obviously I have issues I have
issues with some of Jim Davidson's
lifestyle choices but as just sat there
smiling away in the front all I can
think is Jim
Davidson is proper famous and by proper
famous I mean he rose to Fame in the
1970s when we only had three TV chats
and you know what if you were famous in
the' 70s you are still famous now in 197
n a dog appeared on an episode of The
Watch consumer watch dog show that's
life and that dog said there you go one
episode of a consumer Watchdog show 33
years ago"
azr_ma8h6yc,https://www.youtube.com/watch?v=azr_ma8h6yc,Nothing says 'email efficiency' like a follow-up phone call 📞📧,60.0,6176.0,Comedy Central UK,@comedycentraluk,en,"you ever called the wrong number they're
always in aren't
they you you got the wrong number that's
what they always say you got why have we
always got the wrong number you might
have the wrong
house
H it's like email email is meant to be a
faster way of communicating what happens
when somebody sends you email they ring
you up I'm send you email
ring me back when you read
it and that's my wife who I love with my
whole soul I I love her so much I loved
her the first day I met her and I love
her so much now even more probably and I
have a daughter as well Molly she uh
she's eight she ate me in the bollocks
the other day
wow she's a woman I'm trying to teach
you to fight went come on she went off"
zQidY1665KI,https://www.youtube.com/watch?v=zQidY1665KI,Don't Get Rich Quick By Kidnapping Sunil Patel | Comedy Central Live,55.0,5402.0,Comedy Central UK,@comedycentraluk,en,"we got you some kidnap insurance
oh that's an issue as well now is it
okay fine
I was like send me the documents I want
to see what I'm insured for right and
they send me the documents for the
kidnap insurance
and they said I'm insured against kidnap
for five thousand dollars
I was like this can't be this can't be
right it can't be that little all right
and I look I just read the whole
Insurance document right back to front
right it turns out if you kidnap me you
don't even get five thousand dollars to
release me what you get is a hundred
dollars a day up to a maximum of 50 days
so you're incentivized to keep me for 50
days
to claim your money all right it's
cheaper to get me kidnapped than put me
up in a hotel there right laughs"
B2mZEqNJX7M,https://www.youtube.com/watch?v=B2mZEqNJX7M,Everyone inherited those bootcut genes 🤠,40.0,1042.0,Comedy Central UK,@comedycentraluk,en,"do we all understand the concept of
family like the people that you didn't
choose but now you have them because you
were
born that kind of vibe now you're stuck
with these people
forever um I don't really get on with a
lot of my family I feel like I don't
have a lot in common with a lot of them
I think the closest I ever feel to them
is that we all have thick
ankles uh and I feel like some of you
guys are trying to check out my ankles
now
which is inappropriate also I tailor my
wardrobe so that you will never see my
ankles stop trying"
BarN2L6qAWg,https://www.youtube.com/watch?v=BarN2L6qAWg,BREAKING NEWS: I deny all f**k boy allegations... 🥶 #ComedyCentralLive #StandUp #MichaelOdewale,23.0,3124.0,Comedy Central UK,@comedycentraluk,en,"I wish I could get in trouble and then
just start talking about myself in third
person get out of
situation you know what I mean like my
girl accuses me of cheating I'm just
like Michael odw is very Weare the
allegations being made against him right
now
uh unfortunately he cannot coming at
this current moment in
time but according to my sources that is
lying"
bG5KKmKp3YE,https://www.youtube.com/watch?v=bG5KKmKp3YE,Automated phone systems will test your patience 📞🤬,58.0,5868.0,Comedy Central UK,@comedycentraluk,en,"what is it now we've got machines that
can't talk properly you ever tried to
pay your phone bill over the phone it's
us that have to try and sound like the
machine otherwise nothing gets done you
ring him up and he goes ah do pay your
bill please say pay
bill pay
bill please say pay bill p Bill P Bill P
Bill P bill p
[Music]
b what's going
on and why haven't they got the numbers
thing sorted out with those machines
have you heard them machines say numbers
you give it your account number and it
goes did you say
37215 I'm back on the chat line here oh
oh oh oh yeah keep going love that's
lovely yeah
[Applause]"
5LNxnCJC1qM,https://www.youtube.com/watch?v=5LNxnCJC1qM,Nothing in this country compares to the impeccable vibes of the clinic 😎🫶,60.0,845.0,Comedy Central UK,@comedycentraluk,en,"getting married that's cool isn't it
looking forward to it but there certain
things I'm starting to miss now I'm
settled down like I'm getting married
got kids and stuff and there's certain
things I'm starting to miss and you know
when you settle down there are certain
things that you accept that you'll kind
of Miss like you know going out when you
want or doing what you want or breathing
in that way you feel
comfortable but for me like it's the
stuff that I realize I'll never ever get
to do again so for example um I haven't
been to the SD clinic in six
years just miss the vibe do you know
what I mean down there has anyone
recently some weird Woos
there I love it down there I love what
they've done with the place I love the
reception area I think it's one of the
most amazing places in the UK so what
they do in the reception area right they
mix all the genders so everyone has to
wait in the same reception area right
and if you're a woman in the sexual
health clinic in that Reception Area you
could be there getting the pill you
could be there getting the implant you
could be there getting the coil you
could basically be there for any number
of inent reasons and if you're allad in
there it's cuz you're dirty little
bastard"
IDs4TvWEOUE,https://www.youtube.com/watch?v=IDs4TvWEOUE,Wearing bread shoes this summer... 🍞,60.0,1705.0,Comedy Central UK,@comedycentraluk,en,TranscriptsDisabled
t-vnzceJmBw,https://www.youtube.com/watch?v=t-vnzceJmBw,It must be working out cause Chris McCausland is on Comedy Central Live tonight at 10! 🤩😂,55.0,4985.0,Comedy Central UK,@comedycentraluk,en,"I've been doing this for 21 years 21
years and like this this far in this
this is all I've got now I I have no
other options I've got a degree in
computers but from when the internet was
5 years
old that's like having a degree in
medicine but from when everything was
leeches I didn't even get a good degree
by the way I got a
22 a 2 two from Kingston University
which some of you may be aware is the
finest University in the whole of
Kingston and I went to Kingston cuz a
mate of mine went there the year before
he was having loads of fun he said why
don't you come down here I said yeah all
right I will do then such was my lack of
research into my academic future I
didn't even send away for a prospectus I
went there purely based on the anecdotal
evidence of one single"
sgJ5gEzQhF4,https://www.youtube.com/watch?v=sgJ5gEzQhF4,Not even the risotto recipes are safe | Ahir Shah: Dots,55.0,5488.0,Comedy Central UK,@comedycentraluk,en,"as a member of a minority you're
expected to have opinions on behalf of
people who aren't you right quite often
when you're in a minority people will
assume you have opinions that you don't
after several media appearances in this
country I have received emails from
strangers asking why I want to impose
Sharia law on the
west which as the atheist son of Hindu
parents makes me feel ever so
naughty Sharia more
huh we're expected to have opinions on
everything now social media has done
this to us the internet more broadly I
feel like any time I'm on any website
within about 10 seconds I'm in a comment
section where someone's just going
Define what you mean by gender in the
Contemporary world I'm like I came here
to learn how to make a
risoto"
rzDNv1Erupg,https://www.youtube.com/watch?v=rzDNv1Erupg,Free speech was made solely so we could start fights in pubs,49.0,3940.0,Comedy Central UK,@comedycentraluk,en,"because there's a thing we have in these
Mighty islands of ours that's very
special it's a thing that we the British
developed that we own and we've spread
around the world is of course Free
Speech now free speech is the most
beautiful thing in the world and if you
don't like free speech what I say to you
is this shut the up
off now that may not be Winston
Churchill it may not be William shakes
Spirit it'll do
me cuz free speech is precious free
speech is valuable and it's Clinging On
By fingernails in Britain right now
right now things have got to such a
state where you can't go into a pub and
say something we'll definitely start a
fight without people being offended what
the"
2HaAwdBthGo,https://www.youtube.com/watch?v=2HaAwdBthGo,Baking gets Messi...⚽️🍰,37.0,11658.0,Comedy Central UK,@comedycentraluk,en,"Me and my wife are different. I like
watching football on the telly. I
genuinely believe I can help those
footballers. I sit on the sofa. I scream
advice. Sometimes if there's a corner, I
jump off the sofa and I try and head the
ball in
myself. My wife likes the British Bake
Off. I've never seen her in front of the
TV
like bake it. You never seen that. She's
never had to walk away at the end of an
episode. Just give me five minutes,
Ross, because it's messed up my fantasy
cake league. You do not understand."
WsXUYr_tT3Y,https://www.youtube.com/watch?v=WsXUYr_tT3Y,"That sounds just like our Gaz, what a troublemaker 🤪",60.0,1415.0,Comedy Central UK,@comedycentraluk,en,"now where am I from um I'm born here so
you can't kick me out okay unless I
decide to commit an act of Terror shout
out shamima now here's the
thing on paper that sounds like a fair
deal okay if you're going to blow up the
country you can't come back in all right
it seems like a fair deal except for
that isn't the same deal for everyone
not everyone has conditional citizenship
okay and if she wasn't a brown girl
right and she was just more of a lad
more of a g
G I feel like this country be a bit more
sympathetic right like imagine Gary
being on morning television go Gary why
did you join Isis and he' be
like a level with
you it was a Friday
night I said I was only going to go out
for one next I know Neils brought over a
trus
andas I blacked out in the cab I fought
him on my way home I've woken up I've
only gone enjoyed Isis"
IJdpXe-eU1Q,https://www.youtube.com/watch?v=IJdpXe-eU1Q,Eshaan Akbar Loves An Airport Sesh | Comedy Central Live,52.0,5197.0,Comedy Central UK,@comedycentraluk,en,"the kind of happened but you know when
you think you're making eye contact with
someone but you're actually looking at
their cheek like I was I was so hammered
I was standing in the queue just swaying
side to side and that's when the drunken
anxiety hit me I was like oh my God I
can't believe this
I'm about to become the first Muslim
rejected from flying for being too drunk
then how to think about it again try to
drink some water settle down in my brain
I was like hold on hold on hold on
again that is embarrassing but Silver
Lining if I was the first Muslim
rejected from flying for being too drunk
that might be an international service
because imagine that'd make the News
Daily Mail would print a headline Muslim
man rejected from flying but being too
drunk and someone's going to read that
and go they're all right actually"
cCTV6v_5PK8,https://www.youtube.com/watch?v=cCTV6v_5PK8,Tough out here when your options are 'man without bedding' or 'Vauxhall Corsa' 🚗😮‍💨,53.0,887.0,Comedy Central UK,@comedycentraluk,en,"I struggle to find a partner and I don't
know why cuz I don't ask for much for
example I've never shagged a man who
uses a
pillowcase is that
relatable it's bad that is it it's like
clothes for your bed it's like eating a
Sunday dinner without a
plate and I'm like I can fix
you and they're like mate I just need to
go D Elm you need to focus on you
I've been focusing on myself a lot I've
been single for ages I've been single
for so long I've started to relate to
the people on that show My Strange
Addiction uh if no one's seen it it's
like a reality show where people are
obsessed with stuff so they're like
marry the
car or shag a plate of mash"
pbZsAPZyRVc,https://www.youtube.com/watch?v=pbZsAPZyRVc,Imagine a budget hotel iron being out-out more than I'm regular out... 🥴,48.0,6432.0,Comedy Central UK,@comedycentraluk,en,"you go to these places you might want to
look smart for your night out there's no
iron why would there be you've got no
Pride I stayed in one I went to the
reception and I said to the receptionist
I said excuse me could I borrow an iron
and this is what he said to me he said
it's out at the moment
it's there is an iron in this world with
more of a social life than me right
secondly it there is one iron in this
building of 300 rooms rooms right that
denoted to me though cuz I saw from his
face he was relieved and I bet he
thought thank God for that one person is
using the iron another person has
requested the iron that means there are
two people in this building with plans
for the future and they haven't checked
in to take their own
lives"
fxuEtIxZXVg,https://www.youtube.com/watch?v=fxuEtIxZXVg,Why Crab Hands Are Better Than Normal Hands | Comedy Central Live,59.0,3210.0,Comedy Central UK,@comedycentraluk,en,"oh yeah
so what I've learned is when you're like
this in the supermarket people leave you
to it
[Laughter]
and because obviously cost of living
crisis at the minute and and all of that
you save a lot of money you see because
because you can't pick anything up
nothing
it also works as well if you're walking
home late at night and uh so you're
walking down Alleyway or something and
you can feel danger and you feel like
there's someone behind you all you do is
and again they leave you to it
the only problem with that is it takes
you so long to get home because you
could only walk sidewards
[Laughter]
[Applause]
oh"
7Uvea6qrZ3g,https://www.youtube.com/watch?v=7Uvea6qrZ3g,It's really hard being the To-Ken 😪🫤,47.0,3289.0,Comedy Central UK,@comedycentraluk,en,"I was the only Chinese kid growing up in
my class uh I was very much the token in
fact they even called me token at least
that's what they put on my Christmas
cards sure there was a space between a
toe and the
Ken still hurts still
hurts it's fun it's fun growing up in
the UK the least racist country in the
world according to a survey and how they
did this survey is they asked the
participant the very foolproof question
are you a
racist as we know racists cannot lie
they're banned by the honor System they
have to tell you they're like cops"
